{
  "schema_version": "sfx-ui-catalog-v1",
  "audit_date": "2026-08-28",
  "scope": "Static Library and every reachable local Play route on main after TASK-030",
  "intent_precedence": ["ERROR", "CANCEL", "POPUP_OPEN", "POPUP_CLOSE", "SWIPE", "SELECT", "CURSOR", "NO_SFX"],
  "interactions": [
    {"id":"global.visible.rejection","destination":"GLOBAL","page":"Settings, Deck editor, Profile, Story, and Match","region":"Visible application-owned feedback","source_modules":["viewer/js/play/settings-dialog.mjs","viewer/js/play/pages/decks-page.mjs","viewer/js/play/pages/profile-page.mjs","viewer/js/play/pages/story-home-page.mjs","viewer/js/play/pages/story-scene-page.mjs","viewer/js/play/pages/game-page.mjs"],"control_family":"Visible validation, persistence, Story, or authority rejection","inputs":["mouse","keyboard","touch"],"trigger_phase":"feedback","event_type":"custom","eligibility":"Application-owned error is already visible","intent":"ERROR","priority":100,"precedence":"Error supersedes the rejected operation cue","cooldown_ms":160,"dedupe_group":"error","overlap_policy":"interrupt","suppression":["duplicate unchanged error","cancelled native confirmation","failure without visible feedback"],"recipe_id":"sfx.error.rejected","selector":"[data-inline-notice][data-tone='error'], [data-action-result='rejected'], .play-global-notice[data-tone='error'], [role='alert']","audit_status":"MAPPED","rationale":"Reachable application-owned rejections receive one restrained Error only after their visible feedback exists."},
    {"id":"global.cursor.mouse","destination":"GLOBAL","page":"Outer shell and all routes","region":"Eligible controls","source_modules":["viewer/js/app.js"],"control_family":"Mouse entry onto a new enabled control","inputs":["mouse"],"trigger_phase":"pointer_entry","event_type":"pointerover","eligibility":"Trusted mouse pointer; newly entered enabled control","intent":"CURSOR","priority":10,"precedence":"Lowest audible intent","cooldown_ms":45,"dedupe_group":"cursor","overlap_policy":"drop","suppression":["touch or pen pointer","same control","disabled control","initial render"],"recipe_id":"sfx.cursor.mechanical","selector":"button:not(:disabled), a[href], select:not(:disabled), input:not(:disabled):not([type=hidden]), summary","audit_status":"MAPPED","rationale":"One restrained positional cue; child transitions and stationary pointer movement are deduplicated."},
    {"id":"global.cursor.keyboard","destination":"GLOBAL","page":"Outer shell and all routes","region":"Eligible controls","source_modules":["viewer/js/app.js"],"control_family":"Deliberate keyboard focus traversal","inputs":["keyboard"],"trigger_phase":"focus","event_type":"focusin","eligibility":"Trusted Tab traversal to a new enabled control","intent":"CURSOR","priority":11,"precedence":"Lowest audible intent","cooldown_ms":45,"dedupe_group":"cursor","overlap_policy":"drop","suppression":["programmatic focus","dialog focus placement or restoration","route restoration","pointer-caused focus","disabled control"],"recipe_id":"sfx.cursor.rise","selector":"button:not(:disabled), a[href], select:not(:disabled), input:not(:disabled):not([type=hidden]), summary","audit_status":"MAPPED","rationale":"Keyboard focus is audible only when Tab navigation caused it."},
    {"id":"global.audio.unlock","destination":"GLOBAL","page":"Outer shell","region":"Document","source_modules":["viewer/js/app.js"],"control_family":"First trusted activation that unlocks Web Audio","inputs":["mouse","keyboard","touch"],"trigger_phase":"activation_policy","event_type":"none","eligibility":"First trusted pointer or non-modifier key activation","intent":"NO_SFX","priority":100,"precedence":"Policy gate","cooldown_ms":0,"dedupe_group":"unlock","overlap_policy":"none","suppression":["all queued or earlier interactions"],"recipe_id":null,"selector":null,"audit_status":"NO_SFX","rationale":"Unlock never produces a catch-up cue."},
    {"id":"global.touch.hover","destination":"GLOBAL","page":"All routes","region":"Eligible controls","source_modules":["viewer/js/app.js"],"control_family":"Touch or pen traversal/hover emulation","inputs":["touch"],"trigger_phase":"pointer_entry","event_type":"pointerover","eligibility":"Any non-mouse pointer entry","intent":"NO_SFX","priority":100,"precedence":"Suppression","cooldown_ms":0,"dedupe_group":"cursor","overlap_policy":"none","suppression":["always"],"recipe_id":null,"selector":"button, a[href], select, input, summary","audit_status":"NO_SFX","rationale":"Touch must not chatter while a finger moves across controls."},
    {"id":"global.programmatic.transitions","destination":"GLOBAL","page":"All routes","region":"Document and app root","source_modules":["viewer/js/app.js","viewer/js/play/play-app.mjs","viewer/js/play/ui-continuity.mjs"],"control_family":"Initial render, route change, rerender, restored focus, or scripted click","inputs":["programmatic"],"trigger_phase":"passive","event_type":"none","eligibility":"Untrusted or application-authored transition","intent":"NO_SFX","priority":100,"precedence":"Suppression","cooldown_ms":0,"dedupe_group":"programmatic","overlap_policy":"none","suppression":["always"],"recipe_id":null,"selector":null,"audit_status":"NO_SFX","rationale":"Only direct user interaction may request UI audio."},
    {"id":"global.disabled.noop","destination":"GLOBAL","page":"All routes","region":"All controls","source_modules":["viewer/js/app.js"],"control_family":"Disabled, rejected-before-handler, or semantic no-op control","inputs":["mouse","keyboard","touch","programmatic"],"trigger_phase":"eligibility","event_type":"none","eligibility":"disabled, aria-disabled, resolving, or unchanged pressed/current value","intent":"NO_SFX","priority":100,"precedence":"Suppression","cooldown_ms":0,"dedupe_group":"noop","overlap_policy":"none","suppression":["always"],"recipe_id":null,"selector":"button:disabled, select:disabled, input:disabled, [aria-disabled=true]","audit_status":"NO_SFX","rationale":"Unavailable and unchanged controls must not acknowledge an action."},
    {"id":"shell.navigation","destination":"GLOBAL","page":"Outer shell","region":"Brand and area navigation","source_modules":["viewer/index.html","viewer/js/app.js"],"control_family":"Brand, Library, Play, and Play subnavigation links","inputs":["mouse","keyboard","touch"],"trigger_phase":"activation","event_type":"click","eligibility":"Trusted activation that changes destination","intent":"SELECT","priority":30,"precedence":"Routine navigation","cooldown_ms":35,"dedupe_group":"navigation","overlap_policy":"interrupt","suppression":["current-route no-op","modified/new-tab activation"],"recipe_id":"sfx.select.mechanical","selector":".brand-lockup, .area-tab, .play-subnav a","audit_status":"MAPPED","rationale":"Top-level destination selection is a routine commit, not a spatial page swipe."},
    {"id":"settings.open","destination":"GLOBAL","page":"Settings","region":"Outer triggers","source_modules":["viewer/index.html","viewer/js/play/pages/home-page.mjs","viewer/js/play/play-app.mjs"],"control_family":"Open Settings dialog","inputs":["mouse","keyboard","touch"],"trigger_phase":"activation","event_type":"click","eligibility":"Trusted enabled activation","intent":"POPUP_OPEN","priority":70,"precedence":"Popup Open suppresses Select","cooldown_ms":80,"dedupe_group":"popup","overlap_policy":"interrupt","suppression":["dialog already open"],"recipe_id":"sfx.popup.open","selector":"#settings-trigger, [data-open-settings]","audit_status":"MAPPED","rationale":"Settings creates a modal layer."},
    {"id":"settings.close","destination":"GLOBAL","page":"Settings","region":"Dialog header/backdrop/Escape","source_modules":["viewer/js/play/settings-dialog.mjs","viewer/js/play/dom-utils.mjs"],"control_family":"Cancel or dismiss Settings without committing the current edit","inputs":["mouse","keyboard","touch"],"trigger_phase":"activation","event_type":"click","eligibility":"Dialog open and trusted close request","intent":"CANCEL","priority":90,"precedence":"Cancel suppresses Popup Close","cooldown_ms":80,"dedupe_group":"popup","overlap_policy":"interrupt","suppression":["close caused by successful save, import, reset, or tutorial launch"],"recipe_id":"sfx.cancel.mechanical","selector":"[data-close-settings]","audit_status":"MAPPED","rationale":"The explicit close button abandons uncommitted fields."},
    {"id":"settings.fields.commit","destination":"GLOBAL","page":"Settings","region":"Match setup and interaction","source_modules":["viewer/js/play/settings-dialog.mjs"],"control_family":"Ticket, Bench, Motion, drag, and import-confirmation value commit","inputs":["mouse","keyboard","touch"],"trigger_phase":"value_commit","event_type":"change","eligibility":"Enabled control value changed by the user","intent":"SELECT","priority":35,"precedence":"Committed value","cooldown_ms":35,"dedupe_group":"settings-value","overlap_policy":"interrupt","suppression":["same value","initial population"],"recipe_id":"sfx.select.mechanical","selector":"#settings-ticket-count, #settings-bench-view, #settings-motion, #settings-drag, #confirm-import-check","audit_status":"MAPPED","rationale":"A committed setting value receives one confirmation."},
    {"id":"settings.volume.input","destination":"GLOBAL","page":"Settings","region":"Sound effects","source_modules":["viewer/js/play/settings-dialog.mjs"],"control_family":"Sound-effect volume slider movement","inputs":["mouse","keyboard","touch"],"trigger_phase":"continuous_input","event_type":"input","eligibility":"Any input step","intent":"NO_SFX","priority":100,"precedence":"Explicit silence","cooldown_ms":0,"dedupe_group":"settings-volume","overlap_policy":"none","suppression":["always"],"recipe_id":null,"selector":"#settings-sfx-volume","audit_status":"NO_SFX","rationale":"Slider movement updates visible output but never emits audio; Preview is the only audition path."},